{
  "id": "refs",
  "title": "References",
  "summary": "A short explainer for every id the portal shows.",
  "refs": [
    {
      "id": "phase-p1-foundation",
      "kind": "phase",
      "title": "P1 Foundation",
      "summary": "Get the tools and repo ready, then test the riskiest assumptions with small throwaway experiments.",
      "status": "Not started",
      "related": [],
      "aliases": [
        "P1"
      ]
    },
    {
      "id": "p1.1",
      "kind": "task",
      "title": "Confirm the toolchain",
      "summary": "Tools installed → record exact versions → every later result names the tools it was built with.",
      "status": "Not started",
      "related": [
        "phase-p1-foundation"
      ]
    },
    {
      "id": "adr-0007",
      "kind": "decision",
      "title": "Decision 7: One window, many web views",
      "summary": "Ferrum draws its own buttons in a trusted panel; each website lives in its own sandboxed view.",
      "status": "Accepted",
      "related": [
        "risk-r02"
      ]
    },
    {
      "id": "risk-r02",
      "kind": "risk",
      "title": "Multi-view feature may be unstable",
      "summary": "The feature that puts many web views in one window is experimental and could break.",
      "status": "Open",
      "related": [
        "adr-0007"
      ]
    },
    {
      "id": "rq-01",
      "kind": "research-question",
      "title": "Memory footprint",
      "summary": "Does Ferrum use less memory?",
      "status": "Open",
      "related": []
    },
    {
      "id": "comp-core",
      "kind": "component",
      "title": "Core library",
      "summary": "Settings, URL checks and shared types used by every engine part.",
      "status": "Planned",
      "related": []
    },
    {
      "id": "Q-001",
      "kind": "question",
      "title": "Run tests on every change?",
      "summary": "Should test scripts also run automatically on every change? Decides whether mistakes are caught on each change or only at the gate.",
      "status": "Open",
      "related": []
    },
    {
      "id": "ab12cd3",
      "kind": "commit",
      "title": "Fixture commit",
      "summary": "Saved the fixture pages.",
      "status": null,
      "related": []
    },
    {
      "id": "layer-base",
      "kind": "layer",
      "title": "Shared base",
      "summary": "Settings, URL checks and shared types.",
      "status": null,
      "related": [
        "comp-core"
      ]
    },
    {
      "id": "application",
      "kind": "group",
      "title": "Application",
      "summary": "What people use.",
      "status": null,
      "related": [
        "comp-core"
      ]
    },
    {
      "id": "benchmark",
      "kind": "group",
      "title": "Benchmark",
      "summary": "Fair, repeated tests.",
      "status": null,
      "related": []
    },
    {
      "id": "testing",
      "kind": "group",
      "title": "Testing & quality",
      "summary": "Proves each feature works.",
      "status": null,
      "related": []
    },
    {
      "id": "research",
      "kind": "group",
      "title": "Research & analysis",
      "summary": "Turns numbers into the paper.",
      "status": null,
      "related": []
    }
  ]
}
